{
  "schema_version": "architecture_rules.v1",
  "description": "The Application Architecture standard as checkable rules. rig runs the static and trace checks deterministically; the Reviewer's architecture lens is generated from the lens asks of the rules whose applies_when matches the unit's features.v1 structure.touches. A check at stage 'specified' is not yet run by rig; its rule still feeds the lens.",
  "source": "02_BackendZone/05_Application_Architecture.md",
  "parameters": {
    "ownership_registry": "Each service's data_stores list in its Genesis vending record; rig reads the vendored copy.",
    "max_sync_call_depth": 3,
    "max_authz_cache_ttl_seconds": 3600,
    "review_sampling_ratio": 1
  },
  "conventions": {
    "semconv": [
      "service.name",
      "db.system.name",
      "db.namespace",
      "db.operation.name",
      "messaging.system",
      "messaging.operation.type",
      "messaging.destination.name",
      "http.request.method",
      "url.template",
      "server.address"
    ],
    "platform_spans": {
      "db.transaction": "Wraps one database transaction, from begin to commit or rollback. Every db, client, and producer span inside it is its descendant.",
      "outbox.relay": "Root of the relay's trace: reads outbox rows and publishes them.",
      "inbox.check": "The consumer's lookup and insert of the event ID in its inbox table."
    },
    "platform_attributes": {
      "app.timeout_ms": "On every CLIENT span: the timeout configured for the call, in milliseconds.",
      "app.retry.attempt": "On every CLIENT span: 0 for the first attempt, then 1, 2, ...",
      "app.idempotency_key.present": "On every non-idempotent CLIENT span: true when the request carries an idempotency key.",
      "app.db.isolation_level": "On db.transaction: the isolation level the code chose.",
      "app.governor.limit": "On spans run under a Governor: its configured concurrency limit."
    }
  },
  "touches": [
    "module_import",
    "new_deployable",
    "db_access",
    "db_transaction",
    "migration",
    "contract",
    "queue_definition",
    "queue_publish",
    "queue_consume",
    "http_client",
    "list_endpoint",
    "cache"
  ],
  "rules": [
    {
      "id": "ARCH-001",
      "section": "§1",
      "title": "Modules import only each other's public interface",
      "intent": "Module boundaries inside the monolith hold like repository boundaries, so a module can later become a service.",
      "blocking": true,
      "applies_when": ["module_import"],
      "static_check": {
        "stage": "specified",
        "detects": "An import of a path inside another module that is not in that module's declared public interface (rig rule illegal_boundary_import)."
      },
      "lens": { "ask": "Does the change couple to another module's internal behavior through a side channel the import check cannot see (shared globals, reflection, string-keyed lookups)?" }
    },
    {
      "id": "ARCH-002",
      "section": "§1",
      "title": "A module becomes a service only for a recorded, measured reason",
      "intent": "Each service adds a network hop, a failure mode, a pipeline, and an identity; it must pay for itself.",
      "blocking": true,
      "applies_when": ["new_deployable"],
      "static_check": {
        "stage": "specified",
        "detects": "A change adds a deployable unit without a split record naming the reason (scaling, failure isolation, ownership, runtime or security boundary) and its evidence."
      },
      "lens": { "ask": "Does the recorded evidence (RED/USE metrics, an incident record, an ownership conflict) actually support the split, or is the reason speculative?" }
    },
    {
      "id": "ARCH-003",
      "section": "§2",
      "title": "One owner per data store",
      "intent": "Only the owning service reads or writes its store, so the owner can change its schema safely.",
      "blocking": true,
      "applies_when": ["db_access"],
      "static_check": {
        "stage": "specified",
        "detects": "IaC that grants a non-owner identity access to a store, or code and configuration in one service that connect to a store the ownership registry assigns to another."
      },
      "trace_check": {
        "stage": "specified",
        "detects": "A db span whose service.name is not the registered owner of its db.namespace.",
        "requires": ["service.name", "db.namespace"]
      },
      "lens": { "ask": "Does the change read another service's data indirectly, for example through a shared reporting replica or an export file, instead of its API or events?" }
    },
    {
      "id": "ARCH-004",
      "section": "§2",
      "title": "Data crosses boundaries only through versioned contracts",
      "intent": "APIs and events are the only interfaces between owners; contracts shared across repositories live once in schemas/.",
      "blocking": true,
      "applies_when": ["contract"],
      "static_check": {
        "stage": "specified",
        "detects": "A cross-boundary payload type without a version, or a local copy of a contract that exists in the vendored schemas (rig rule contract_copy)."
      },
      "lens": { "ask": "Does the change pass data between services through a channel that is not a versioned API or event?" }
    },
    {
      "id": "ARCH-005",
      "section": "§3",
      "title": "No network call inside a database transaction",
      "intent": "A slow remote call holding a transaction open exhausts connection pools and locks.",
      "blocking": true,
      "applies_when": ["db_transaction"],
      "static_check": {
        "stage": "specified",
        "detects": "An HTTP, gRPC, or queue client call lexically inside a transaction callback or between begin and commit."
      },
      "trace_check": {
        "stage": "specified",
        "detects": "A span of kind CLIENT or PRODUCER that is a descendant of a db.transaction span, other than the transaction's own db spans.",
        "requires": ["db.transaction", "db.system.name"]
      },
      "lens": { "ask": "Can any call inside the transaction block on something remote through indirection the checks did not exercise (a callback, an injected dependency, a lazy-loaded client)?" }
    },
    {
      "id": "ARCH-006",
      "section": "§3",
      "title": "Isolation level is chosen and recorded",
      "intent": "The database default is a decision too; read-then-write workflows state theirs.",
      "blocking": false,
      "applies_when": ["db_transaction"],
      "static_check": {
        "stage": "specified",
        "detects": "A transaction that reads and then writes without an explicit isolation level."
      },
      "trace_check": {
        "stage": "specified",
        "detects": "A db.transaction span containing both read and write db operations with no app.db.isolation_level.",
        "requires": ["db.transaction", "app.db.isolation_level", "db.operation.name"]
      },
      "lens": { "ask": "Is the chosen isolation level sufficient for this read-then-write workflow, or can a concurrent writer cause a lost update or a write skew?" }
    },
    {
      "id": "ARCH-007",
      "section": "§3",
      "title": "Connection pools are bounded Governors",
      "intent": "A pool has a maximum size from Little's Law, a wait timeout, and metrics.",
      "blocking": true,
      "applies_when": ["db_access"],
      "static_check": {
        "stage": "specified",
        "detects": "A connection pool configured without a maximum size or an acquire timeout."
      },
      "lens": { "ask": "Is the pool size consistent with the expected arrival rate times P99 query duration, and with the database's connection limit across all replicas?" }
    },
    {
      "id": "ARCH-008",
      "section": "§4",
      "title": "One expand-or-contract step per change",
      "intent": "Never break readers and writers in one step; each schema step deploys and reverts on its own.",
      "blocking": true,
      "applies_when": ["migration"],
      "static_check": {
        "stage": "specified",
        "detects": "A migration that both adds and removes schema objects, renames a column or table in place, changes a column's type in place, or adds a NOT NULL column without a default."
      },
      "lens": { "ask": "Does the code in this change still work against both the previous and the next schema step?" }
    },
    {
      "id": "ARCH-009",
      "section": "§4",
      "title": "The contract step is irreversible and human-approved",
      "intent": "Dropping the old shape cannot be undone; a person approves it after confirming a backup exists.",
      "blocking": false,
      "protected_class": "irreversible",
      "applies_when": ["migration"],
      "static_check": {
        "stage": "specified",
        "detects": "A migration that drops a column, table, or index, or narrows a type. The hit routes the change to required human approval; it does not block by itself."
      },
      "lens": { "ask": "Has the switch-reads step run cleanly in production, and is anything still reading or writing the old shape?" }
    },
    {
      "id": "ARCH-010",
      "section": "§4",
      "title": "Backfills run in bounded, resumable batches",
      "intent": "A backfill respects the Governor and can resume after a failure.",
      "blocking": false,
      "applies_when": ["migration"],
      "static_check": {
        "stage": "specified",
        "detects": "A data migration that updates rows without a batch bound or a resume key."
      },
      "lens": { "ask": "Can the backfill be stopped and resumed without redoing or skipping rows, and does its rate stay under the database's headroom?" }
    },
    {
      "id": "ARCH-011",
      "section": "§5",
      "title": "Events are published through a transactional outbox",
      "intent": "The business change and its event commit together; a relay publishes the event.",
      "blocking": true,
      "applies_when": ["queue_publish"],
      "static_check": {